UC9 Ability to extend employee_payroll table to have Basic Pay, Deductions, Taxable Pay, Income Tax, Net Pay.

mysql> select * from employee_payroll where name = 'Terisa';
+----+--------+---------+--------------+------------+--------+-----------+------------+-------------+-----+---------+------------+
| id | name   | address | phone_number | department | gender | basic_pay | deductions | taxable_pay | tax | net_pay | start      |
+----+--------+---------+--------------+------------+--------+-----------+------------+-------------+-----+---------+------------+
|  2 | Terisa | NULL    | NULL         |            | F      |   3000000 |          0 |           0 |   0 |       0 | 2019-11-13 |
+----+--------+---------+--------------+------------+--------+-----------+------------+-------------+-----+---------+------------+
1 row in set (0.00 sec)

mysql> INSERT INTO employee_payroll (name, department, gender, basic_pay, deductions, taxable_pay, tax, net_pay, start) VALUES ('Terisa', 'Marketing', 'F', 3000000.00, 1000000.00, 2000000.00, 500000.00, 1500000.00, '2018-01-03');
Query OK, 1 row affected (0.00 sec)

mysql> select * from employee_payroll where name = 'Terisa';
+----+--------+---------+--------------+------------+--------+-----------+------------+-------------+--------+---------+------------+
| id | name   | address | phone_number | department | gender | basic_pay | deductions | taxable_pay | tax    | net_pay | start      |
+----+--------+---------+--------------+------------+--------+-----------+------------+-------------+--------+---------+------------+
|  2 | Terisa | NULL    | NULL         |            | F      |   3000000 |          0 |           0 |      0 |       0 | 2019-11-13 |
|  4 | Terisa | TBD     | NULL         | Marketing  | F      |   3000000 |    1000000 |     2000000 | 500000 | 1500000 | 2018-01-03 |
+----+--------+---------+--------------+------------+--------+-----------+------------+-------------+--------+---------+------------+
2 rows in set (0.00 sec)

mysql> update employee_payroll set department = 'Sales' where address = 'Null';
Query OK, 2 rows affected (0.00 sec)
Rows matched: 2  Changed: 2  Warnings: 0

mysql> select * from employee_payroll where name = 'Terisa';
+----+--------+---------+--------------+------------+--------+-----------+------------+-------------+--------+---------+------------+
| id | name   | address | phone_number | department | gender | basic_pay | deductions | taxable_pay | tax    | net_pay | start      |
+----+--------+---------+--------------+------------+--------+-----------+------------+-------------+--------+---------+------------+
|  2 | Terisa | NULL    | NULL         | Sales      | F      |   3000000 |          0 |           0 |      0 |       0 | 2019-11-13 |
|  4 | Terisa | TBD     | NULL         | Marketing  | F      |   3000000 |    1000000 |     2000000 | 500000 | 1500000 | 2018-01-03 |
+----+--------+---------+--------------+------------+--------+-----------+------------+-------------+--------+---------+------------+
2 rows in set (0.00 sec)